{
  "schema_version": 3,
  "artifact_type": "object_track_summary",
  "storage_layout": "compact_v1",
  "generation_id": "00000000-0000-4000-8000-000000000001",
  "coordinate_frame": "world",
  "units": {"distance": "meters"},
  "summary": {"frame_count": 1, "track_count": 1},
  "source_fused_json": "fusion/frame_fused_candidates.json",
  "object_tracks": [
    {"object_id": "O1", "frame_ids": ["0"]}
  ],
  "frame_decision_inputs": [
    {
      "frame_id": "0",
      "frame_ref": "fusion/frames/000000_0/fused_objects.json",
      "candidate_objects": [
        {
          "object_id": "O1",
          "point_count": 2,
          "visible_camera": ["front"]
        }
      ],
      "pairwise_relations": []
    }
  ]
}

